{
 "id": "test",
 "breite": 48,
 "hoehe": 32,
 "tile": 16,
 "boden": null,
 "kollision": [
  "111111111111111111111111111111111111111111111111",
  "100000000000000000000000000000000000000000000001",
  "100000000000000000000000000000000000000000000001",
  "100000000000000000000000000000000000000000000001",
  "100000000000000000000000000000000000000000000001",
  "100000000000000000000000000000000000000000000001",
  "100000000000000000000000000000000000000000000001",
  "100000000000000000000000000000000000000000000001",
  "100000000011111111110000000000000000000000000001",
  "100000000000000000000000000000000000000000000001",
  "100000000000000000000000000000000000000000000001",
  "100000000000000000000000000000000000000000000001",
  "100000000000000000000000000000000000000000000001",
  "100000000000000000000000000000000000000000000001",
  "100000000000000000000000000000100000000000000001",
  "100000000000000000000000000000100000000000000001",
  "100000000000000000000000000000100000000000000001",
  "100000000000000000000000000000100000000000000001",
  "100000000000000000000000000000100000000000000001",
  "100000000000000000000000000000100000000000000001",
  "100000001110000000000000000000100000000000000001",
  "100000001110000000000000000000100000000000000001",
  "100000001110000000000000000000100000000000000001",
  "100000000000000000000000000000100000000000000001",
  "100000000000000000000000000000000000000000000001",
  "100000000000000000000000000000000000000000000001",
  "100000000000000000000000000000000000000000000001",
  "100000000000000000000000000000000000000000000001",
  "100000000000000000000000000000000000000000000001",
  "100000000000000000000000000000000000000000000001",
  "100000000000000000000000000000000000000000000001",
  "111111111111111111111111111111111111111111111111"
 ],
 "objekte": [
  {
   "typ": "platzhalter",
   "x": 600,
   "y": 120,
   "sprite": null,
   "fuss": {
    "x": -12,
    "y": -6,
    "w": 24,
    "h": 6
   }
  }
 ],
 "interaktionen": [],
 "ausgaenge": [],
 "einstiege": {
  "start": {
   "x": 384,
   "y": 256,
   "richtung": "runter"
  }
 }
}
